<?xml version="1.0" encoding="UTF-8"?>

<notes xmlns:at="http://www.w3.org/2001/XMLSchema-instance" 
	at:noNamespaceSchemaLocation="Note1.xsd">
	
  <note lang="english">
  <to>Toveq</to>
  <from>Jani</from>
  <heading>Reminder</heading>
  <body>Don't forget me this weekend!</body>
  
  </note>
  
  <note lang="english">
  <to>Tovew</to>
  <from>Jani</from>
  <heading>Reminder</heading>
  <body>Don't forget me this weekend!</body>
  </note>
  
  <note lang="english">
  <to>Tovwwe</to>
  <from>Jani</from>
  <heading>Reminder</heading>
  <body>Don't forget me this weekend!</body>
  </note>
  
  
</notes> 